,Filename,Truth,Inference,CER-upd,CER-2-u,,,CER,CER2
1174,images/e04-091-s00-01.png.jpg,against the transom .,against the transom.,4.76,4.87,,,4.761904762,4.87804878
1175,images/b06-000-s01-00.png.jpg,""" Britain is uncomfortable in her role of champion",""" Britain is uncomfortable in her role of champion",0,0,,,0,0
1176,images/d06-104-s00-03.png.jpg,"to five of the timetable , the following","to five of the timetable, the following",2.5,2.53,,,2.5,2.53164557
1177,images/h06-085-s00-00.png.jpg,It is also important to remember that on,It is also important to remember that on,0,0,,,0,0
1178,images/g06-031l-s04-02.png.jpg,"great at the return of Ultratoryism , that the Commons","great at the return of Ultratoryism, that the Commons",1.85,1.86,,,1.851851852,1.869158879
1179,images/j06-030-s01-05.png.jpg,rank as anomalous is the,rank as anonymous is the,12.5,6.38,,,12.5,6.382978723
1180,images/a05-039-s03-01.png.jpg,"veteran United Party politician , Mr. Harry","veteran United Party politician, Mr. Harry",2.32,2.35,,,2.325581395,2.352941176
1181,images/r06-076-s00-00.png.jpg,They all had that neat look of,They all had that neat look of,0,0,,,0,0
1182,images/h02-012-s02-00.png.jpg,"First , we were asked to examine the risks","First, we were asked to examine the risks",2.38,2.4,,,2.380952381,2.409638554
1183,images/r03-065-s06-02.png.jpg,saw to that .,saw to that.,7.69,8,,,7.692307692,8
1184,images/g07-047-s01-07.png.jpg,mixing with really low and horrid people such,mixing with really loss and world people such,11.11,7.86,,,11.11111111,7.865168539
1185,images/g06-050o-s01-02.png.jpg,symptoms .,symptoms.,10,10.52,,,10,10.52631579
1186,images/r06-106-s03-00.png.jpg,She looked,she looked,10,5.26,,,10,5.263157895
1187,images/a01-043x-s04-00.png.jpg,One of his tasks,One of his tasks,0,0,,,0,0
1188,images/r02-146-s03-01.png.jpg,after him .,after him.,9.09,9.52,,,9.090909091,9.523809524
1189,images/l04-071-s03-00.png.jpg,No doubt she had every intention,No doubt she had every intention,0,0,,,0,0
1190,images/g01-012-s02-02.png.jpg,comparing the failure of a subsidized duke,comprising the failure of a publicized dulke,16.66,10.84,,,16.66666667,10.84337349
1191,images/a05-013-s02-00.png.jpg,This was to,This was too,9.09,9.52,,,9.090909091,9.523809524
1192,images/a01-132u-s00-00.png.jpg,""" That cannot continue without either development",""" That cannot continue without either development",0,0,,,0,0
1193,images/f07-046a-s00-04.png.jpg,as an article of diet .,"as an article of diet, Is",13.04,11.11,,,13.04347826,11.11111111
1194,images/e04-114-s03-00.png.jpg,I prefer spacing screws 3 in. apart for,I prefer spacing screws 3 in. apart for,0,0,,,0,0
1195,images/f07-088b-s01-00.png.jpg,"Shelley , for example ,","Shelley, for example,",8.69,8.88,,,8.695652174,8.888888889
1196,images/g07-026a-s00-04.png.jpg,"implacable wife , purveying to her in secret","implacable wife, forveying the her in secret",11.36,8.04,,,11.36363636,8.045977011
1197,images/a01-091-s01-01.png.jpg,in answer to their whips to defeat a,in answer to their whips to defeat a,0,0,,,0,0
1198,images/e07-112-s00-02.png.jpg,has been gained with them .,has been gained with them.,3.7,3.77,,,3.703703704,3.773584906
1199,images/d07-102-s01-02.png.jpg,and the court of Solomon . ',and the court of Solomon. ',3.57,3.63,,,3.571428571,3.636363636
1200,images/r02-070-s01-02.png.jpg,MONOTECHNIC INSTITUTE ADVANCED ACCOUNTANCY,MONOTECHNIC INSTITUTE ADVANCED ACCOUNTANCY,0,0,,,0,0
1201,images/m01-100-s01-02.png.jpg,the way .,the way.,11.11,11.76,,,11.11111111,11.76470588
1202,images/b01-122-s02-00.png.jpg,The Archbishop of,The Archbishop of,0,0,,,0,0
1203,images/j06-022-s01-04.png.jpg,reported as showing no migration .,reported as shown by no migration.,14.7,10.44,,,14.70588235,10.44776119
1204,images/h07-075a-s01-02.png.jpg,"or a flat at once to anyone # eligible for one ,","raflot at once to anyone else eligible for one,",18.75,16.84,,,18.75,16.84210526
1205,images/a03-080-s00-03.png.jpg,various rocket stages had already been,various rocket stages had already been,0,0,,,0,0
1206,images/k03-144-s06-00.png.jpg,"' The younger ones like Gore , Vaughan ,",""" The younger ones like Gore, Vaughan,",7.5,6.32,,,7.5,6.329113924
1207,images/g06-101-s02-00.png.jpg,"After months of suffering , his life was","After months of suffering, his life was",2.5,2.53,,,2.5,2.53164557
1208,images/m06-076-s00-00.png.jpg,So it lets us rule it . ',So it lets us rule it. ',4,4.08,,,4,4.081632653
1209,images/r06-121-s00-05.png.jpg,towards each other as they talked .,towards each other as they talked.,2.85,2.89,,,2.857142857,2.898550725
1210,images/g04-014-s00-02.png.jpg,was 800 feet high above the sea level !,was 800 feet high above the sea level!,2.56,2.59,,,2.564102564,2.597402597
1211,images/b01-027-s03-00.png.jpg,The Queen has won a triumph .,The Queen has won a triumph.,3.44,3.5,,,3.448275862,3.50877193
1212,images/f01-143-s02-01.png.jpg,"of the doctor who observes signs , and records symptoms ,","of the doctor who observes signs, and records symptoms,",3.5,3.53,,,3.50877193,3.539823009
1213,images/g01-088-s01-02.png.jpg,the suggestion that the rich should help,the suggestion that the rich absolutely,20,11.39,,,20,11.39240506
1214,images/a01-091u-s01-00.png.jpg,For the Tories were massed in answer to,For the Tories were massed in answer to,0,0,,,0,0
1215,images/p02-069-s04-01.png.jpg,"alone . """,alone. ',22.22,17.64,,,22.22222222,17.64705882
1216,images/a02-046-s00-00.png.jpg,"At 9.40 Mr. Edusei , Minister of Transport and pro-","At 9.40 Mr. Edusei, Minister of Transport and pro-",1.96,1.98,,,1.960784314,1.98019802
1217,images/d06-020-s01-01.png.jpg,the way to face life .,the way to face life.,4.54,4.65,,,4.545454545,4.651162791
1218,images/m03-033-s00-00.png.jpg,"' Bottle-Foot , my lord . '","' Battle-foot, my lord. '",14.81,11.32,,,14.81481481,11.32075472
1219,images/k04-068-s01-00.png.jpg,He was a,He was a,0,0,,,0,0
1220,images/c06-020-s02-01.png.jpg,"a journalist , I write to entertain rather","a journalist, I write to entertain rather",2.38,2.4,,,2.380952381,2.409638554
1221,images/c03-016b-s03-00.png.jpg,As is the case in Fanny her,As is the case in Fanny her,0,0,,,0,0
1222,images/a06-070-s03-01.png.jpg,"long statement , Mr. Macmillan stated the","long statement, Mr. Macmillan started the",4.87,4.93,,,4.87804878,4.938271605
1223,images/p01-155-s00-00.png.jpg,Mr. Copthorne was on dry land in a church,Mr. Copthorne was on dry land in a church.,2.43,2.46,,,2.43902439,2.469135802
1224,images/h04-052-s00-01.png.jpg,or with adolescents but no children consumed more fresh green,or with adolescents but no children consumed more fresh green,0,0,,,0,0
1225,images/b04-010-s01-01.png.jpg,Britain .,britain.,22.22,17.64,,,22.22222222,17.64705882
1226,images/a02-090-s01-01.png.jpg,that a few months ago Mr. Kaunda said that,that a few months ago Mr. Kaunda said that,0,0,,,0,0
1227,images/e04-091-s01-04.png.jpg,transom framing .,transom framing.,5.88,6.06,,,5.882352941,6.060606061
1228,images/m01-095-s03-01.png.jpg,turned back on McKenzie Avenue .,turned back on Mc Kenzie Avenue.,6.25,6.34,,,6.25,6.349206349
1229,images/e04-095-s01-03.png.jpg,are parallel horizontally .,are parallel horizontally.,3.7,3.77,,,3.703703704,3.773584906
1230,images/e07-094-s02-00.png.jpg,"Usually cylindrical or hexagonal in shape , they","Usually cylindrical or hexagonal in shape, they",2.08,2.1,,,2.083333333,2.105263158
1231,images/l04-020-s02-00.png.jpg,See you,see you,14.28,7.69,,,14.28571429,7.692307692
1232,images/d01-052-s01-01.png.jpg,Gospel represents the work of generations of,Gospel represents the work of generations of,0,0,,,0,0
1233,images/m02-095-s02-03.png.jpg,and counteract the obsession with economics,and counteract the obsession with economics,0,0,,,0,0
1234,images/p02-081-s00-01.png.jpg,decided to go back and join Lilyan and,decided to go back and join Libyan and,2.63,1.33,,,2.631578947,1.333333333
1235,images/c03-096c-s01-00.png.jpg,"The rest , one feels , were","The rest, one feels, were",7.4,7.54,,,7.407407407,7.547169811
1236,images/m06-031-s07-00.png.jpg,Some die .,sorce die.,40,31.57,,,40,31.57894737
1237,images/g04-026-s01-01.png.jpg,old school friend at Clifton .,old school friend at Clifton.,3.33,3.38,,,3.333333333,3.389830508
1238,images/a02-111-s02-03.png.jpg,""" Ban-the-Bomb "" demonstrators .",""" Ban-the-Bomb "" demonstrators",6.25,6.34,,,6.25,6.349206349
1239,images/d06-011-s00-01.png.jpg,"all the elements of fear can arise suddenly ,","all the elements of fear can arise suddenly,",2.22,2.24,,,2.222222222,2.247191011
1240,images/c03-087c-s00-00.png.jpg,"It went , perhaps , some distance beyond most treatments","It went, perhaps, some distance beyond most treatments",3.57,3.6,,,3.571428571,3.603603604
1241,images/g06-042m-s01-00.png.jpg,"As early as 1830 , when","Mr early as 1830, when",13.04,8.88,,,13.04347826,8.888888889
1242,images/g05-098-s00-02.png.jpg,special precautions to guard the lives of our airmen .,special precautions to guard the lives of our airmen.,1.85,1.86,,,1.851851852,1.869158879
1243,images/d01-049-s01-00.png.jpg,To understand how,To understand how,0,0,,,0,0
1244,images/b04-181-s02-01.png.jpg,now supplanted Britain as Denmark's,new supplanted Britain as Denmark's,2.85,1.44,,,2.857142857,1.449275362
1245,images/k04-163-s00-03.png.jpg,instructions on the matter .,Instructions on the matter.,7.14,5.45,,,7.142857143,5.454545455
1246,images/a01-000u-s00-03.png.jpg,Ps tomorrow .,MPs tomorrow.,15.38,16,,,15.38461538,16
1247,images/n02-120-s01-00.png.jpg,""" There 's a difference",""" There's a difference",4.34,4.44,,,4.347826087,4.444444444
1248,images/r06-018-s00-01.png.jpg,6al view ; good intimate furnishing and colour ; running,back view ; good in time # furnishing and colour ; running,12.5,8.1,,,12.5,8.108108108
1249,images/a01-049-s00-01.png.jpg,off the opposition by telling a television,of the opposition by telling a television,2.38,2.4,,,2.380952381,2.409638554
1250,images/l07-172-s00-01.png.jpg,"engine and decided , apparently on the strength","enagine and decided, apparently on the strength",4.25,4.3,,,4.255319149,4.301075269
1251,images/m06-091-s00-00.png.jpg,' No ! ' the Chief Captive said with both mouths .,' No!'the Chief Captive said with both months.,10,9.09,,,10,9.090909091
1252,images/m04-164-s14-01.png.jpg,fifty thousand feet .,fifty thousand feet.,4.76,4.87,,,4.761904762,4.87804878
1253,images/c03-003f-s01-04.png.jpg,"central characters to their background ,","central characters to their background,",2.5,2.53,,,2.5,2.53164557
1254,images/g06-047l-s01-01.png.jpg,whom Anglesey consulted in May 1834 .,whom Anglesey consulted in May 1834.,2.7,2.73,,,2.702702703,2.739726027
1255,images/g07-007b-s00-02.png.jpg,"and Tita and the steward , Lega Zambelli , failed to perform","and Tita and the stewards, Lega Zambelli, failed to perform",3.33,2.52,,,3.333333333,2.521008403
1256,images/e04-132-s00-02.png.jpg,"also be arranged into a design , and the","also be arranged into a design, and the",2.5,2.53,,,2.5,2.53164557
1257,images/p06-042-s00-00.png.jpg,"And as he spoke , the thought","And as he spoke, the thought",3.44,3.5,,,3.448275862,3.50877193
1258,images/l07-052-s02-00.png.jpg,It 's not as,It's not as,8.33,8.69,,,8.333333333,8.695652174
1259,images/m04-113-s04-01.png.jpg,as he shot past .,as he shot part.,11.76,9.09,,,11.76470588,9.090909091
1260,images/g02-062-s00-01.png.jpg,"of the apex , the thickening of the heart walls , and","of the apex, the thickening of the heart walls, and",3.77,3.8,,,3.773584906,3.80952381
1261,images/p06-042-s01-01.png.jpg,tied .,tied.,16.66,18.18,,,16.66666667,18.18181818
1262,images/m02-102-s02-01.png.jpg,"with university records , the agents of the","with university records, the agents of the",2.32,2.35,,,2.325581395,2.352941176
1263,images/f01-143-s02-00.png.jpg,This is no more queer than the method,This is no more queer than the method,0,0,,,0,0
1264,images/g06-050o-s02-04.png.jpg,"patient and persevering , ' but he appears","patient and persevering, "" but he appears",4.76,3.61,,,4.761904762,3.614457831
1265,images/r06-111-s01-03.png.jpg,romantic than large houses .,romantic than large houses.,3.57,3.63,,,3.571428571,3.636363636
1266,images/g06-026h-s01-02.png.jpg,that ever was .,that ever was.,6.66,6.89,,,6.666666667,6.896551724
1267,images/c06-043-s00-03.png.jpg,condition .,condition.,9.09,9.52,,,9.090909091,9.523809524
1268,images/b06-064-s02-05.png.jpg,"doubtful positions , and for a consistent","doubtful positions, and for a consistent",2.43,2.46,,,2.43902439,2.469135802
1269,images/l01-016-s03-00.png.jpg,The whole family,The whole family,0,0,,,0,0
1270,images/n04-084-s00-00.png.jpg,""" Oh , the Press , "" said Seaweed .",""" Oh, the Press, "" said Senneed",17.14,14.49,,,17.14285714,14.49275362
1271,images/f03-174-s02-00.png.jpg,But there is no need to be frightened .,But there is no need to be frightened.,2.56,2.59,,,2.564102564,2.597402597
1272,images/k07-134-s05-00.png.jpg,Once she quietly,Once she quietly,0,0,,,0,0
1273,images/a03-047-s01-04.png.jpg,"Nations , not the father figure , so necessary","Nations, not the father figure, so necessary",4.34,4.39,,,4.347826087,4.395604396
1274,images/r02-117-s03-01.png.jpg,and I 'm NOT irritable . ',and I'm NOT irritable. ',7.69,7.84,,,7.692307692,7.843137255
1275,images/g06-089-s01-02.png.jpg,September 25th that Anglesey was very much,September 25th that Anglesey was very much,0,0,,,0,0
1276,images/l01-065-s00-08.png.jpg,his appointment with her .,his appointment with her. ',7.69,5.88,,,7.692307692,5.882352941
1277,images/g06-011n-s01-02.png.jpg,health permitted him to enjoy,health permitted him to enjoy,0,0,,,0,0
1278,images/m01-032-s04-02.png.jpg,"shell of flesh and bone , devoid of intellect and","shell of flesh and bone, devoid of intellect and",2.04,2.06,,,2.040816327,2.06185567
1279,images/l07-103-s02-00.png.jpg,If you can get to Bletcham this,If you can get to Bletcham this,0,0,,,0,0
1280,images/j01-049-s00-01.png.jpg,"electrolyte , which can be fabricated into","electrolyte, which can be fabricated into",2.38,2.4,,,2.380952381,2.409638554
1281,images/a04-050-s01-00.png.jpg,But governments should be free to negotiate,But governments should be free to negotiate,0,0,,,0,0
1282,images/g06-045c-s00-05.png.jpg,treated under a doctor who had studied under,treated under a doctor who had studied under,0,0,,,0,0
1283,images/a01-082u-s03-01.png.jpg,in personality last night dominated,in personality last night dominated,0,0,,,0,0
1284,images/g04-088-s02-04.png.jpg,had to miss the Sunday Church from any cause,had to miss the Sunday Church from any cause,0,0,,,0,0
1285,images/g06-018o-s01-01.png.jpg,"he was ' suffering as usual ' , but hoped ,","he was'suffering as usual ', but hoped,",9.3,9.41,,,9.302325581,9.411764706
1286,images/n04-044-s00-00.png.jpg,John's father had been a naval officer of the old,John's father had been a naval officer of the old,0,0,,,0,0
1287,images/e04-079-s02-02.png.jpg,Fig. 2 .,Fig. 2.,12.5,13.33,,,12.5,13.33333333
1288,images/g04-104-s01-01.png.jpg,"Bavaria , asked me if I would do something for two wards","Bavaria, asked me if I would do something for two wards",1.78,1.8,,,1.785714286,1.801801802
1289,images/e02-100-s01-01.png.jpg,better to pay the fair price for a tool of good,better to pay the fair price for a tool of good,0,0,,,0,0
1290,images/p03-163-s08-02.png.jpg,"any minute , and she knew it .","minute, and she knew it.",20,20.33,,,20,20.33898305
1291,images/f07-073-s00-02.png.jpg,aromatics where the paprika insinuates its perfidious,onomatics where the paprika insinuates its perfidious,3.77,1.9,,,3.773584906,1.904761905
1292,images/h07-023-s00-02.png.jpg,"female employees , expressed as a percentage","female employees, expressed as a percentage",2.27,2.29,,,2.272727273,2.298850575
1293,images/n01-009-s02-01.png.jpg,arranging a supper party .,arranging a suppel party.,7.69,5.88,,,7.692307692,5.882352941
1294,images/b01-089-s03-01.png.jpg,re-established in their port by negotiation,reestablished in their part by negotiation,4.65,3.52,,,4.651162791,3.529411765
1295,images/l07-187-s01-04.png.jpg,and there was a delicate iron staircase,and there was a delicate iron staircase,0,0,,,0,0
1296,images/b03-104-s03-02.png.jpg,any reason why the centigrade countries,any reason why the centigrade countries,0,0,,,0,0
1297,images/m06-056-s04-01.png.jpg,young .,young.,14.28,15.38,,,14.28571429,15.38461538
1298,images/d05-040-s04-02.png.jpg,table which was handy for the most improbable uses .,table which was hardly for the most improbable cases.,9.61,7.76,,,9.615384615,7.766990291
1299,images/f07-016-s01-01.png.jpg,"those days , as ever , ate sparingly , but","those days, as ever, ate sparingly, but",7.14,7.22,,,7.142857143,7.228915663
1300,images/m04-100-s05-00.png.jpg,""" It 's all very well , "" commented",""" It's all very well, "" commented",5.71,5.79,,,5.714285714,5.797101449
1301,images/l01-095-s00-01.png.jpg,mother was seriously ill .,mother was seriously ill.,3.84,3.92,,,3.846153846,3.921568627
1302,images/a01-030u-s06-02.png.jpg,delay progress in the talks by refusing,delay progress in the talks by refusing,0,0,,,0,0
1303,images/c06-138-s00-08.png.jpg,to the raree-show emotionalism,to the raree-show emotionalism,0,0,,,0,0
1304,images/a01-113-s02-01.png.jpg,"ceiling on health spending and started charges , Mr. Brown",ceiling on health spending and started charges. Mr. Brown,3.44,2.6,,,3.448275862,2.608695652
1305,images/a06-110-s01-01.png.jpg,"of considerable authority , "" he","of considerable authority, "" he",3.12,3.17,,,3.125,3.174603175
1306,images/c02-082-s00-01.png.jpg,in Moderato Cantabile ( curiously trans-,in Moderato Cantabile ( curiously trans-,0,0,,,0,0
1307,images/r03-084-s01-00.png.jpg,It 's a rule of I.I.I.,# It's a rule of I.I.I.,13.63,9.3,,,13.63636364,9.302325581
1308,images/a03-059-s03-01.png.jpg,"year or not , Mr. Pearson , with his party","year or not, Mr. Pearson, with his party",4.76,4.81,,,4.761904762,4.819277108
1309,images/b04-066-s00-00.png.jpg,One more demonstration of the industry's recovery .,One more demonstration of the industry's recovery.,1.96,1.98,,,1.960784314,1.98019802
1310,images/a06-124-s02-02.png.jpg,"than 163,000,000 of the banks' money is now frozen in the","than 163,000,000 of the banks' money is now frozen in the",0,0,,,0,0
1311,images/p02-027-s02-00.png.jpg,""" I say ! """,""" "" "" "" "" "" "" "" "" "" "" "" "" "" "" "" "" "" """,281.81,271.42,,,281.8181818,271.4285714
1312,images/g06-047r-s00-00.png.jpg,"This remarkable man of medicine , whom Sir Francis","This remarkable man of medicine, whom Sir Francis",2,2.02,,,2,2.02020202
1313,images/l01-065-s01-02.png.jpg,afterwards .,afterwards.,8.33,8.69,,,8.333333333,8.695652174
1314,images/d04-016-s01-00.png.jpg,Such,such,25,14.28,,,25,14.28571429
1315,images/g06-011i-s04-00.png.jpg,"What a gay ,","hat a gay,",16.66,17.39,,,16.66666667,17.39130435
1316,images/c06-103-s00-07.png.jpg,verbal variety and not the visual,verbal variety and not the visual,0,0,,,0,0
1317,images/a03-020-s00-02.png.jpg,claims to be his representative in,claims to be his representative in,0,0,,,0,0
1318,images/h04-071-s00-01.png.jpg,but rose in 1957 when the subsidy on welfare and national dried,but rose in 1957 when the subsidy on welfare and national dried,0,0,,,0,0
1319,images/h04-000-s00-00.png.jpg,"Nevertheless , average net family income","Nevertheless, average net family income",2.5,2.53,,,2.5,2.53164557
1320,images/j01-066-s00-02.png.jpg,isolated after this has been carried out .,isolated after this has been carried out.,2.38,2.4,,,2.380952381,2.409638554
1321,images/a01-043u-s03-01.png.jpg,Weaver of New York .,Weaves of New York.,10,7.69,,,10,7.692307692
1322,images/r06-103-s01-01.png.jpg,"reported her to the police , and then jumped","reported her to the police, and then jumped",2.27,2.29,,,2.272727273,2.298850575
1323,images/e07-072-s02-03.png.jpg,bituminized paper pots which are used on,bituminized paper pots which are used on,0,0,,,0,0
1324,images/r03-050-s00-00.png.jpg,"His aspect was as dusty as his office , with scurf","His aspect was as dusty as his office, with scurf",2,2.02,,,2,2.02020202
1325,images/r03-035-s01-01.png.jpg,"up , then , Mrs. - er - Buttery ? ""","up, then, Mrs. - er - Buttery? """,8.57,8.69,,,8.571428571,8.695652174
1326,images/h04-078-s02-01.png.jpg,four or more children the levels of adequacy for all,four or more children the levels of adequacy for all,0,0,,,0,0
1327,images/r02-117-s07-00.png.jpg,Nobody 's tired .,Nobody's tired.,11.76,12.12,,,11.76470588,12.12121212
1328,images/m04-123-s05-00.png.jpg,The beleaguered passengers peered out of,The beleaguised passengers revered out of,10,6.32,,,10,6.329113924
1329,images/m01-110-s01-03.png.jpg,detection .,detectorism.,45.45,23.8,,,45.45454545,23.80952381
1330,images/c06-103-s00-08.png.jpg,slapstick .,slapstick.,9.09,9.52,,,9.090909091,9.523809524
1331,images/p06-069-s01-01.png.jpg,"up from that first ideal , and how","up from that first ideal, and how",2.94,2.98,,,2.941176471,2.985074627
1332,images/b06-082-s02-02.png.jpg,of Nato .,of Nato.,11.11,11.76,,,11.11111111,11.76470588
1333,images/d01-052-s00-00.png.jpg,THE Fourth Gospel was almost certainly,THE Fourth Gospel was almost certainly,0,0,,,0,0
1334,images/k04-017-s03-02.png.jpg,had been standing near them .,had been standing near them.,3.44,3.5,,,3.448275862,3.50877193
1335,images/l01-030-s02-01.png.jpg,and Dackson's daughter .,and Jackson's daughter.,8.33,6.38,,,8.333333333,6.382978723
1336,images/n04-195-s05-01.png.jpg,I 'll tell my editor that the story 's a dead bird .,I'll tell my editor that the story's a dead bird.,5.76,5.82,,,5.769230769,5.825242718
1337,images/e06-041-s00-00.png.jpg,The Bow-wave Theory .,The Bow-wave Theory.,4.76,4.87,,,4.761904762,4.87804878
1338,images/b06-082-s01-01.png.jpg,the use of nuclear weapons and nuclear strategy,the use of nuclear weapons and nuclear strategy,0,0,,,0,0
1339,images/r06-103-s01-02.png.jpg,off a cliff near Monte Carlo .,off a cliff near Monte Carlo.,3.33,3.38,,,3.333333333,3.389830508
1340,images/f04-024-s01-00.png.jpg,At a spot on the embankment between,it a spot on the embankment between,2.85,1.44,,,2.857142857,1.449275362
1341,images/a04-010-s00-01.png.jpg,Admiralty House meeting will be made in the,Admiralty House meeting will be made in the,0,0,,,0,0
1342,images/f01-075-s01-01.png.jpg,identified as elementary sensations .,identified as elementary sensations.,2.7,2.73,,,2.702702703,2.739726027
1343,images/r06-044-s01-00.png.jpg,"Monsieur H , for instance , had been clubbed and","Monsieur H, for instance, had been clubbed and",4.16,4.21,,,4.166666667,4.210526316
1344,images/l07-118-s02-00.png.jpg,""" She , "" he corrected .",""" She, "" he corrected.",8.33,8.51,,,8.333333333,8.510638298
1345,images/r03-002-s01-03.png.jpg,tent of utter innocence .,tent of utter innocence.,4,4.08,,,4,4.081632653
1346,images/r06-049-s00-02.png.jpg,but there was no Monsieur V.,but there was no Monsieur V.,0,0,,,0,0
1347,images/e07-072-s00-02.png.jpg,still in greatest demand .,still in greatest demand.,3.84,3.92,,,3.846153846,3.921568627
1348,images/n04-052-s05-00.png.jpg,""" Have a",""" I Have a",25,26.66,,,25,26.66666667
1349,images/a02-042-s01-04.png.jpg,police and 16 armoured cars .,police and 16 armoured cars.,3.44,3.5,,,3.448275862,3.50877193
1350,images/a06-075-s00-04.png.jpg,for negotiations with a view to joining,for negotiations with a view to joining,0,0,,,0,0
1351,images/c03-003a-s02-02.png.jpg,"Mr. Joshua Logan , attempted but failed to create","Mr. Joshua Logan, attempted but failed to create",2.04,2.06,,,2.040816327,2.06185567
1352,images/k03-144-s03-01.png.jpg,is a sign of life - very encouraging ! ',"is a sign of life - very encouraging! """,5,3.79,,,5,3.797468354
1353,images/e04-095-s00-01.png.jpg,and this is the time to check before making fast,and this is the time to check before making fast,0,0,,,0,0
1354,images/m06-067-s00-00.png.jpg,' You are too foul to live ! ' Haris growled .,' You are too foul to live!'Harris growled,13.04,12.08,,,13.04347826,12.08791209
1355,images/d06-011-s02-00.png.jpg,As I shall suggest in a,as I shall suggest in a,4.34,2.22,,,4.347826087,2.222222222
1356,images/g06-018b-s00-00.png.jpg,"When the sailing season was past , he sent","When the sailing season was past, he sent",2.38,2.4,,,2.380952381,2.409638554
1357,images/f04-074-s02-02.png.jpg,into the path of some train ?,into the path of some train?,3.44,3.5,,,3.448275862,3.50877193
1358,images/k04-119-s03-02.png.jpg,was on the door .,was on the door.,5.88,6.06,,,5.882352941,6.060606061
1359,images/b04-040-s05-01.png.jpg,does not want his daughter to marry a Scotsman .,does not want his daughter to marry a Scotsman.,2.08,2.1,,,2.083333333,2.105263158
1360,images/m04-123-s02-00.png.jpg,And,and,33.33,20,,,33.33333333,20
1361,images/f04-039-s01-01.png.jpg,for a man who had been seen leaving the train,for a man who had been seen leaving the train,0,0,,,0,0
1362,images/p06-088-s05-00.png.jpg,Elation,lathor,42.85,30.76,,,42.85714286,30.76923077
1363,images/n04-000-s02-00.png.jpg,John gave a short laugh .,John gave a short laugh.,4,4.08,,,4,4.081632653
1364,images/g06-045o-s00-09.png.jpg,Hahnemann .,stalmenians.,72.72,42.85,,,72.72727273,42.85714286
1365,images/l04-153-s04-01.png.jpg,the Director of Public Prosecutions I know pretty,the Director of Public Prosecutions I know pretty,0,0,,,0,0
1366,images/b06-008-s01-01.png.jpg,"are another stage in the cloak operation ,","are another stage in the cloak operation,",2.38,2.4,,,2.380952381,2.409638554
1367,images/a01-030x-s03-00.png.jpg,""" I",n.,100,80,,,100,80
1368,images/l03-004-s01-00.png.jpg,The thug collapsed with a whistling,The thing collapsed with a whistling,5.71,4.34,,,5.714285714,4.347826087
1369,images/a06-025-s04-01.png.jpg,agreed to postpone operation of the sub-,apced to postpone operation of the sub-,7.5,5.06,,,7.5,5.063291139
